"","x","url","precio","descripcion"
"89",89,"https://www.inmuebles24.com/propiedades/hermoso-departamento-2-cajones-de-estacionamiento-58116759.html","MN 11,500","Hermoso departamento, ubicado en el conjunto habitacional “Tres Lagos Santamaría”, acceso por prolongación Naranjo a un costado del Sam’s la Raza, tiene cerca una plaza comercial con farmacia, tiendas de conveniencia, Banco (BBVA), tintorerías y alimentos.El departamento tiene sala-comedor, 2 recamaras, persianas en todas las ventanas que son de piso a techo, 1 baño, cocina equipada, área de lavado, gas natural, bodega de 4m2, y 2 lugares de estacionamiento uno tras otro.Podrás disfrutar de una inigualable vista, ya que se encuentra en el piso 21, el último piso de la torre, además de que no tienes vecino en el piso de arriba.Podrás disfrutar de servicios como:• Alberca, chapoteadero, jacuzzi y regaderas,• Gimnasio equipado,• Salón de usos múltiples,• Roof Garden,• Jardines y áreas de convivencia familiar con juegos infantiles,• Área para mascotas,• Cuarto de recolección de basura,• Elevadores con acceso por huella digital,• Vigilancia las 24 horas para tranquilidad tuya y de tu familia.La ubicación es inigualable ya que se encuentra sobre circuito interior, anímate y has una cita para conocerlo, no te arrepentirás.*El precio incluye la cuota de mantenimientoRequisitos:•	Identificación Oficial,•	Recibos de nómina con ingresos comprobables 3 a 1,•	Aval con propiedad en la Ciudad de México,•	Mes corriente más 1 mes de depósito en garantía."
"90",90,"https://www.inmuebles24.com/propiedades/departamento-en-renta-en-san-juan-tlihuaca-58296326.html","MN 9,500","Nocnok ID: MX20-HY9522. DEPA DE 2 RECAMRAS EN PLANTA BAJA, MUY CERCA DEL CCH AZCAPO Y METROS AQUILES SERDAN Y TEZOZOMOC, PLAZA COMERCIAL TOWN CENTER, COCINA INTEGRAL, SALAL COMEDOR AMPLIA Estátus jurídico: Libre de gravamen.ADVERTENCIA:  Recuerda que nunca debes dar un anticipo sin validar que esta publicación sea legítima. NOCNOK no se hace responsable por la información contenida en los anuncios publicados por los usuarios a través de su sistema."
"91",91,"https://www.inmuebles24.com/propiedades/departamento-en-renta-en-ampliacion-del-gas-58289622.html","MN 12,500","Bonito depto en Tres Lagos Santa María- Dos recamaras con closet completos- Dos baños completos- Sala comedor - Cuarto de servicio- 1 estacionamiento El desarrollo cuenta con gimnasio, salón de eventos, alberca, seguridad 24 horas, áreas verdes, 1 estacionamiento. Junto a Sam´s Club La Raza.- $Ver datos incluye mantenimientoRequisitos:- 1 Renta- 1 Deposito- Póliza Jurídica"
"92",92,"https://www.inmuebles24.com/propiedades/departamento-en-renta-en-cosmopolita-oasis-58018657.html","MN 13,200","Departamento con balcón, acabados de lujo, dos recamaras con closet, dos baños, dos cajones de estacionamiento, sala, estancia, comedor, cocina integral, patio de servicio, vigilancia 24 horas, parque de mascotas, centro de fitness, piscina, portero, entrada con seguridad, acceso para silla de ruedas, ascensor. Centros comerciales cercanos, escuelas cercanas"
"93",93,"https://www.inmuebles24.com/propiedades/departamento-en-renta-en-san-pedro-xalpa-57394862.html","MN 14,000","Nocnok ID: MX19-HF1619. SE RENTA PENT HOUSE EN 14,000ADVERTENCIA:  Recuerda que nunca debes dar un anticipo sin validar que esta publicación sea legítima. NOCNOK no se hace responsable por la información contenida en los anuncios publicados por los usuarios a través de su sistema."
"94",94,"https://www.inmuebles24.com/propiedades/departamento-en-renta-en-oasis-residencial-57994053.html","MN 13,200","Departamento con balcón, acabados de lujo, dos recamaras con closet, dos baños, dos cajones de estacionamiento, sala, estancia, comedor, cocina integral, patio de servicio, vigilancia intramuros.68 M2 de construcción"
"95",95,"https://www.inmuebles24.com/propiedades/departamento-en-renta-en-del-recreo-58128712.html","MN 12,000","Hermoso departamento, ubicado a pocos minutos del centro de azcapotzalco, Aquiles Serdán y camarones, áreas de recreo y salón de usos múltiples, vigilancia las 24 hrs."
"96",96,"https://www.inmuebles24.com/propiedades/departamento-en-renta-colonia-del-gas-atzcapotzalco-58027949.html","MN 13,000","Departamento en Renta Colonia del Gas, Atzcapotzalco,Parque Jardín. Cerca de PolancoIncluye MantenimientoDe 75 m2 con bonita vista al Jardín 3 recámaras con closet2 baños completosCocina Integral con barraCuarto de servicioSala y comedor amplios1 Bodega amplia2 estacionamientosEl conjunto cuenta con elevadores con seguridad de huella (biómetricos), cámaras externas e internas del conjunto, seguridad 24 hrs, jardín amplio, juegos para niños, plaza con centros comerciales y gym. Cerca de escuelas y muy bien ubicado.Próximamente las mejores amenidadesEjercítate en la pista de jogging, ponte en forma en el gimnasio, practica natación en la alberca, lleva a tus hijos al skate park o juega voleibol en las áreas deportivas. Encuentra diferentes opciones para mantener una vida saludable. Comparte tiempo con amigos y familia en los salones de usos múltiples y diviértete con tus hijos en las áreas verdes y los juegos infantiles.para mayor información comunicarse al Ver datos-37Nayeli"
"97",97,"https://www.inmuebles24.com/propiedades/departamento-nuevo-en-renta-tlatilco-azcapotzalco-58074391.html","MN 11,000","Departamento de 60m2 con dos recámaras con clóset, 1 baño completo, cocina equipada con refrigerador, centro de lavado (lavadora, lavadero  y secadora), dos elevadores, balcón hacia el exterior, 1 cajón de estacionamiento, vigilancia 24 horas, ingreso automatizado"
"98",98,"https://www.inmuebles24.com/propiedades/departamento-en-renta-en-san-pedro-xalpa-57923133.html","MN 11,500",": Calz San Isidro 610San Pedro XalpaDelegación AzcapotzalcoEs un edificio de 10 niveles: 72m2Dos recamaras y dos baños completosCajón de estacionamientoCuota de mantenimiento ya incluida en la renta$11,500"
"99",99,"https://www.inmuebles24.com/propiedades/departamento-en-renta-en-azcapotzalco-57915472.html","MN 8,000","Departamento recién remodelado. Todo nuevo. Elevador. Todos los servicios pagados. Muy céntrico, al lado del metro ""Ferrería"" y la estación ""Fortuna"" del Suburbano."
"100",100,"https://www.inmuebles24.com/propiedades/departamento-en-renta-en-san-andres-58116932.html","MN 9,000","lindo y acogedor departamento de 3 recamas un baño y un cajón de estacionamiento, cuenta con cocina integral espacio para sala y comedor y área de lavado"
"101",101,"https://www.inmuebles24.com/propiedades/departamento-en-renta-en-ampliacion-del-gas-58082104.html","MN 13,000","Departamento amueblado consta de 2 habitaciones con closet, sala, comedor, cocina integral, área de lavado en el departamento, baño completo, 1 lugar de estacionamiento y vigilancia 24 horas.Cuenta con amenidades como:-Alberca.-Gimnasio.-Salón de multiplicables.-Áreas verdes.-Área para mascotas.-Área de juegos infantiles.SE ENTREGA AMUEBLADO Y EQUIPADOmantenimiento incluido.Condición construcción: Buena"
"102",102,"https://www.inmuebles24.com/propiedades/bonito-departamento-por-la-glorieta-de-camarones-muy-58049136.html","MN 10,000","RENTO HERMOSO DEPARTAMENTO MUY BIEN UBICADO,  POR LA GLORIETA DE CAMARONES, ALCALDIA AZCAPOTZALCO A 15 MIN DE VALLEJO, 15 MIN DE MARINA NACIONAL Y 20 MIN DE POLANCO.CON LAS SIGUIENTES CARACTERISTICAS:* 2 RECAMARAS CON CLOSET Y PISO DE PARQUET.* 1 BAÑO COMPLETO.* COMEDOR AMPLIO CON PISO DE MARMOL.* SALA AMPLIA CON PISO DE MARMOL.* COCINA INTEGRAL EQUIPADA CON PISO DE MARMOL..* ESTACIONAMIENTO PARA 1 AUTO (TECHADO)* PUERTA ELECTRICA.* GAS ESTACIONARIO.* AREA PARA LAVAR CON LUGAR INDEPENDIENTE PARA TENDER.* ACABADOS DE LUJO.* LINEA TELEFONICA.* INTERFON.* PERSIANAS EN TODAS LAS VENTANAS.* AMPLIO Y BIEN ILUMINADO.* SOLO 8 DEPARTAMENTOS Y MUY SEGURO.EL DEPARTAMENTO ESTA EN EXCELENTES CONDICIONES, LISTO PARA HABITARSE, CON TODOS LOS SERVICIOS. IDEAL PARA RECIEN CASADOS SIN NIÑOS, NI MASCOTAS.LA RENTA ES DE $10,000 PESOS MENSUALES. INTERESADOS LLAMAR AL Ver datos."
